{
    "$schema": "https://json-schema.org/draft/2020-12/schema",
    "$id": "https://github.com/manami-project/anime-offline-database/blob/raw/dead-entries/dead-entries.schema.json",
    "title": "anime-offline-database",
    "description": "Updated every week: A JSON based anime dataset containing the most important meta data as well as cross references to various anime sites such as MAL, ANIDB, ANILIST, KITSU and more...",
    "type": "object",
    "required": [
        "license",
        "repository",
        "lastUpdate",
        "deadEntries"
    ],
    "properties": {
        "license": {
            "description": "Information about the license of the dataset.",
            "type": "object",
            "required": [
                "name",
                "url"
            ],
            "properties": {
                "name": {
                    "description": "Name of the license.",
                    "const": "GNU Affero General Public License v3.0"
                },
                "url": {
                    "description": "URL to the whole license file.",
                    "const": "https://github.com/manami-project/anime-offline-database/blob/master/LICENSE"
                }
            }
        },
        "repository": {
            "description": "URL of this github repository which is the source of the dataset.",
            "const": "https://github.com/manami-project/anime-offline-database"
        },
        "lastUpdate": {
            "description": "The date on which the file was updated in the format: YYYY-MM-DD.",
            "type": "string"
        },
        "deadEntries": {
            "description": "IDs of anime which have been removed from the respective meta data provider.",
            "type": "array",
            "uniqueItems": true,
            "items": {
                "type": "string"
            }
        }
    }
}